Title,Source,URL,Published At,Description
ExxonMobil (XOM) Reveals Hammerhead Project Development Plan,Yahoo Entertainment,https://finance.yahoo.com/news/exxonmobil-xom-reveals-hammerhead-project-131100776.html,2024-07-16T13:11:00Z,ExxonMobil's (XOM) development plan for Hammerhead involves drilling up to 30 wells. The company plans to use a Very Large Crude Carrier conversion facility ...
Tesla robotaxi won't be ready for scale until 2030: Analyst,Yahoo Entertainment,https://finance.yahoo.com/video/tesla-robotaxi-wont-ready-scale-151912360.html,2024-07-12T15:19:12Z,Tesla (TSLA) shares are trading higher on Friday despite a Bloomberg report indicating a two-month delay in unveiling the company's highly anticipated...
"Tesla is building a robotaxi, but there's a hidden cost",Yahoo Entertainment,https://finance.yahoo.com/video/tesla-building-robotaxi-theres-hidden-120040525.html,2024-07-20T12:00:40Z,"Tesla (TSLA) will report its latest quarterly report on Tuesday, July 23 after the closing bell with investors patiently awaiting any news on its robotaxi..."
Cathie Wood says she wouldn't have sold Nvidia stake 'had we known that the market was going to reward it',Business Insider,https://www.businessinsider.com/cathie-wood-would-have-held-nvidia-if-knew-going-up-2024-7,2024-07-15T07:32:21Z,"Cathie Wood's investment fund, Ark Invest sold at least $4.5 million worth of Nvidia stock this year, per The Wall Street Journal."
TD Cowen raises AAPL target to $250 on AI and China sales,AppleInsider,https://appleinsider.com/articles/24/07/29/td-cowen-raises-aapl-target-to-250-on-ai-and-china-sales,2024-07-29T11:01:32Z,"Investment analyst firm TD Cowen predicts that Apple Intelligence will bring a modest boost to the iPhone 16 range, but be much more significant in 2025, by when China sales are expected to have returned to growth.Render of the iPhone 16 rangeAhead of Apple's…"
Cathie Wood is buying the dip with CrowdStrike,Business Insider,https://www.businessinsider.com/cathie-wood-is-buying-the-dip-with-crowdstrike-2024-7,2024-07-23T05:31:29Z,"According to Barron's, two of Wood's exchange-traded funds bought nearly $12 million of CrowdStrike stock after last week's global tech outage."
Apple (APPL) Third Quarter Earnings: When is it and what can we expect?,ReadWrite,https://readwrite.com/apple-appl-third-quarter-earnings-when-is-it-and-what-can-we-expect/,2024-07-31T10:52:08Z,"Apple will report its third-quarter earnings for the fiscal year this week and investors will be the world’s most valuable… Continue reading Apple (APPL) Third Quarter Earnings: When is it and what can we expect?
The post Apple (APPL) Third Quarter Earnings: …"
Tesla keeps touting self-driving but one analyst's near-crash shows it's 'not even close' to autonomy,Business Insider,https://www.businessinsider.com/analyst-says-near-tesla-crash-tesla-shows-fsd-not-ready-2024-7,2024-07-30T16:39:27Z,"A Truist Analyst tested Tesla's FSD and said he had to make three interventions, one of which would have led to a ""certain accident."""
Is Chevron A Better Integrated Oil Major Pick Over Exxon Mobil?,Forbes,https://www.forbes.com/sites/greatspeculations/2024/07/18/is-chevron-a-better-integrated-oil-major-pick-over-exxon-mobil/,2024-07-18T09:00:00Z,We believe that Chevron Corporation (NYSE: CVX) is a better pick than its industry peer. Exxon Mobil (NYSE: XOM). CVX stock trades at a slightly higher multiple of 1.5x..
"Market Clubhouse Morning Memo - July 31st, 2024 (Trade Strategy For SPY, QQQ, AAPL, MSFT, NVDA, GOOGL, META And TSLA)",Biztoc.com,https://biztoc.com/x/b5e3390e748203cd,2024-07-31T14:23:54Z,"Good Morning Traders! In today's Market Clubhouse Morning Memo, we will discuss SPY, QQQ, AAPL, MSFT, NVDA, GOOGL, META, and TSLA.
Our proprietary formula, exclusive to Market Clubhouse, dictates these price levels. This dynamic equation takes into account pr…"
Rotation To Small-Cap From Tech Stocks Continues,Forbes,https://www.forbes.com/sites/bill_stone/2024/07/28/rotation-to-small-cap-from-tech-stocks-continues/,2024-07-28T09:22:42Z,"Earnings season kicks off its busiest week, with four Magnificent 7 technology stocks. In addition, the Fed meeting and the monthly jobs report provide crucial data."
Easing Inflation Ignites Fed Expectations And Small-Cap Stocks,Forbes,https://www.forbes.com/sites/bill_stone/2024/07/14/easing-inflation-ignites-fed-expectations-and-small-cap-stocks/,2024-07-14T11:00:00Z,"While earnings season has begun well, inflation was primarily responsible for the broad rally. Earnings, retail sales, and Fedspeak will be the focal points this week."
"JPMorgan Stock Is Up 21% YTD, What To Expect From Q2 Results?",Forbes,https://www.forbes.com/sites/greatspeculations/2024/07/10/jpmorgan-stock-is-up-21-ytd-what-to-expect-from-q2-results/,2024-07-10T10:00:44Z,"JPMorgan (NYSE: JPM) stock has gained 21% YTD, as compared to the 17% rise in the S&P500 index. Notably, JPMorgan’s peer Citigroup (NYSE: C) is up 22% YTD."
Will Pfizer Stock Post A Downbeat Q2?,Forbes,https://www.forbes.com/sites/greatspeculations/2024/07/26/will-pfizer-stock-post-a-downbeat-q2/,2024-07-26T14:00:30Z,"The company is likely to see higher sales, led by an uptick in Eliquis and Prevnar sales. However, we think that the top-line may fall short of analyst expectations.."
1JPM: A Maven/Gradle alternative in a single Java file,Github.com,https://github.com/Osiris-Team/1JPM,2024-07-08T15:45:40Z,"1 Java Project Manager, is a Maven/Gradle alternative with a twist. Its a single Java file itself, which should be edited by you to configure your project. - Osiris-Team/1JPM"
Pfizer Vs. Eli Lilly Stock – Which Is A Better Pick?,Forbes,https://www.forbes.com/sites/greatspeculations/2024/07/11/pfizer-vs-eli-lilly-stock--which-is-a-better-pick/,2024-07-11T13:30:50Z,"We believe that Eli Lilly stock (NYSE: LLY) is currently a better pick than its industry peer – Pfizer stock, given its better prospects."
10 to 15% of portfolio should be in SMID caps: BMO's Belski,Yahoo Entertainment,https://finance.yahoo.com/video/10-15-portfolio-smid-caps-141354555.html,2024-07-23T14:13:54Z,"US equities (^GSPC, ^DJI, ^IXIC) waver in pre-market hours as the market patiently awaits Big Tech earnings reports out from Alphabet (GOOG, GOOGL) and Tesla..."
Technology Stocks Sink Despite Better Earnings,Forbes,https://www.forbes.com/sites/bill_stone/2024/07/21/technology-stocks-sink-despite-better-earnings/,2024-07-21T11:00:00Z,The 2nd busiest week of earnings includes Magnificent 7 companies and 2Q GDP. The rise of small-caps and banks illustrates the expectations of rate cuts and no recession.
Technical Assessment: Bullish in the Intermediate-Term,Yahoo Entertainment,https://finance.yahoo.com/research/reports/ARGUS_40491_TechnicalAnalysis_1720004817000/,2024-07-03T11:06:57Z,"Find the latest KLA Corporation (KLAC) stock forecast based on top analyst's estimates, plus more investing and trading data from Yahoo Finance"
Tesla’s Energy Business Grew 2x In Q2. What’s Next?,Forbes,https://www.forbes.com/sites/greatspeculations/2024/07/25/teslas-energy-business-grew-2x-in-q2-whats-next/,2024-07-25T11:00:00Z,"Tesla published a mixed set of Q2 2024 results on July 23, with automotive revenue declining by close to 7% year-over-year and earnings declining by 42%"
The Magnificent Seven Stocks Suffer Their Worst Market Cap Loss In Two Years,Investor's Business Daily,https://www.investors.com/news/sp-500-magnificent-seven-stocks-market-cap-loss/,2024-07-18T12:27:33Z,The seven titans have lost $1.13 trillion in market cap in 5 days.
"After 50% Move Last Month, Where Is Tesla Stock Headed Post Q2 Earnings?",Forbes,https://www.forbes.com/sites/greatspeculations/2024/07/11/after-50-move-last-month-where-is-tesla-stock-headed-post-q2-earnings/,2024-07-11T10:30:32Z,"Tesla is expected to publish its Q2 2024 results on July 23, reporting on a quarter that saw the company deliver 443,956 vehicles. While the numbers were ahead of.."
Tesla Stock Roars Back As Some Analysts Buy Into Full Self-Driving Hype,Forbes,https://www.forbes.com/sites/dereksaul/2024/07/29/tesla-stock-roars-back-as-some-analysts-buy-into-full-self-driving-hype/,2024-07-29T16:02:46Z,"“Tesla may have solved the self-driving puzzle, don’t roll your eyes, buy TSLA,” said one analyst."
R Dygraphs: How To Visualize Time Series Data In R And R Shiny,R-bloggers.com,https://www.r-bloggers.com/2024/07/r-dygraphs-how-to-visualize-time-series-data-in-r-and-r-shiny/,2024-07-02T07:00:03Z,"When it comes to finding an R package capable of making interactive visualizations out of the box while also working flawlessly with R Shiny, you don’t have that many options. Sure, there’s Highcarts, but what if you’re looking for something more specialized …"
Will Apple’s Q3 Results Get An AI Bump?,Forbes,https://www.forbes.com/sites/greatspeculations/2024/07/22/will-apples-q3-results-get-an-ai-bump/,2024-07-22T10:30:00Z,"Apple is expected to publish its Q3 FY’24 results on August 1, reporting on a quarter that is likely to see the company’s business improve, driven by higher Mac, services"
What’s Happening With Chevron’s Stock?,Forbes,https://www.forbes.com/sites/greatspeculations/2024/07/10/whats-happening-with-chevrons-stock/,2024-07-10T14:00:35Z,"Almost flat year-to-date, at the current price of around $154 per share, we believe Chevron Corporation (NYSE: CVX), a company manufacturing and selling a range of.."
Tesla Stock Earnings Preview: Is It A Buy Now Or Later?,Forbes,https://www.forbes.com/sites/investor-hub/article/tesla-tsla-stock-earnings-preview-buy-now-later/,2024-07-17T15:56:01Z,Tesla’s latest earnings report is coming out soon. We review if TSLA stock is a buy now or later and what investors should watch for ahead of earnings.
"Tesla stock rises again, extending monster 40% rally over the past month",Autoblog,https://www.autoblog.com/2024/07/05/tesla-stock-rises-again-extending-monster-40-rally-over-the-past-month/,2024-07-05T15:57:00Z,"Filed under:
 Earnings/Financials,Green,Tesla,Electric
 Continue reading Tesla stock rises again, extending monster 40% rally over the past month
Tesla stock rises again, extending monster 40% rally over the past month originally appeared on Autoblog on Fri, …"
"Tesla’s Q2 Deliveries Strong, But What’s To Come?",Forbes,https://www.forbes.com/sites/bethkindig/2024/07/11/teslas-q2-deliveries-strong-but-whats-to-come/,2024-07-12T01:48:46Z,"After being one of the lowest performing Mag 7 stocks, Tesla stock saw rapid gains, up 42% in a 1 month rally. We assess what's next after TSLA beat Q2 delivery estimates."
Credit Card Charge-Offs Rose in the First Half of 2024. Is JPMorgan Chase Bracing for a Recession?,Biztoc.com,https://biztoc.com/x/a4191f96844496a7,2024-07-19T11:16:56Z,"For the 10th consecutive quarter, charge-offs for credit cards at JPMorgan Chase (NYSE: JPM) rose, indicating that increasing numbers of people are struggling to keep up with their growing debt. In the second quarter, the largest bank in the U.S. charged off …"
"Capital One Stock Is Trailing S&P500 By 8% YTD, What To Expect?",Forbes,https://www.forbes.com/sites/greatspeculations/2024/07/02/capital-one-stock-is-trailing-sp500-by-8-ytd-what-to-expect/,2024-07-02T13:00:11Z,"Amid the current financial backdrop, COF stock has shown strong gains of 40% from levels of $100 in early January 2021 to around $140 now, vs. an increase of about.."
Steve Jobs net worth: How rich could he have been?,Biztoc.com,https://biztoc.com/x/9d23642550b9b725,2024-07-13T23:35:42Z,"In 1997, Apple ( (AAPL) ) launched its “Think Different” advertising campaign, celebrating the misfits, rebels, and revolutionaries whose unique ideas changed the world. 
The popular campaign, which sparked Apple’s massive, multi-billion-dollar turnaround, fe…"
"BlackRock Is Trailing S&P500 By 13% YTD, Is There Room For Growth?",Forbes,https://www.forbes.com/sites/greatspeculations/2024/07/25/blackrock-is-trailing-sp500-by-13-ytd-is-there-room-for-growth/,2024-07-25T12:00:00Z,"BlackRock’s stock (NYSE: BLK) has gained roughly 4% YTD as compared to the 17% rise in the S&P500 index over the same period. In sharp contrast, BlackRock’s peer.."
Should You Expect Upside Potential For Pfizer (PFE)?,Yahoo Entertainment,https://consent.yahoo.com/v2/collectConsent?sessionId=1_cc-session_3d5d44b0-36b4-4696-bc1d-00815029b9e6,2024-07-01T12:13:20Z,
BNY Mellon Stock Is Up 16% YTD; Is There Room For More Growth?,Forbes,https://www.forbes.com/sites/greatspeculations/2024/07/08/bny-mellon-stock-is-up-16-ytd-is-there-room-for-more-growth/,2024-07-08T10:00:07Z,"BNY Mellon stock (NYSE: BK) has gained 16% YTD which is at par with the S&P500 index over the same period. In comparison, BNY Mellon’s peer BlackRock (NYSE: BLK) is up.."
Travelers Stock Was Down 8% In A Day. Why?,Forbes,https://www.forbes.com/sites/greatspeculations/2024/07/23/travelers-stock-was-down-8-in-a-day-why/,2024-07-23T12:00:00Z,"Travelers’ price fell after TRV announced second quarter results, where revenues and premiums missed the street estimates, despite posting a year-on-year growth."
2 Energy Stocks to Avoid in July Amid Oil Rally,Yahoo Entertainment,https://finance.yahoo.com/news/2-energy-stocks-avoid-july-192009240.html,2024-07-01T19:20:09Z,"Oil has been hot lately, but XOM and MRO warrant caution"
Should You Pick Corning Stock After 40% Gains This Year Amid AI Boost?,Forbes,https://www.forbes.com/sites/greatspeculations/2024/07/10/should-you-pick-corning-stock-after-40-gains-this-year-amid-ai-boost/,2024-07-10T11:00:51Z,"Corning stock (NYSE: GLW) saw a 10% rise over the last five days, faring better than its peer — General Electric stock – up 2%. The rise in GLW stock this.."
Tesla And Nvidia Investors Dangerously Delude Themselves,Investor's Business Daily,https://www.investors.com/etfs-and-funds/sectors/sp500-tesla-and-nvidia-investors-delude-themselves/,2024-07-12T12:00:36Z,Stock prices anticipate the future. But such wishful thinking is reaching some extreme levels.
Will AI’s Tough Economics Pop Nvidia’s Bubble?,Forbes,https://www.forbes.com/sites/greatspeculations/2024/07/30/will-ais-tough-economics-pop-nvidias-bubble/,2024-07-30T11:00:00Z,Nvidia has a lot going for it as companies are looking to shift their sizable installed base of traditional data centers to accelerated computing using graphics..
"Tesla Rival BYD's EV Sales Jump 21% In Q2: Details - Tesla (NASDAQ:TSLA), BYD (OTC:BYDDY)",Biztoc.com,https://biztoc.com/x/57dc76a01afb7813,2024-07-03T12:28:11Z,"Chinese electric vehicle manufacturer BYD Company BYDDY reported a 21% increase in electric vehicle sales for the second quarter.
BYD sold 426,039 EVs from April to June, approximately 12,000 units fewer than Tesla, Inc‘s TSLA estimated deliveries, reported R…"
What to Expect From Apple's Quarterly Earnings Report This Week,MacRumors,https://www.macrumors.com/2024/07/31/apple-q3-2024-earnings-preview/,2024-07-31T15:38:58Z,"Apple will report its earnings results for the third quarter of its 2024 fiscal year on Thursday, August 1 at 1:30 p.m. Pacific Time. Apple's CEO Tim Cook and CFO Luca Maestri will discuss the results on a conference call with analysts a half hour later.




…"
Pfizer And Roche Advance On Their Weight Loss Drug Journeys,Yahoo Entertainment,https://finance.yahoo.com/news/pfizer-roche-advance-weight-loss-144852957.html,2024-07-17T14:48:52Z,"After previously discounting a twice-daily version of its weight loss drug due to patients having difficulties tolerating it, Pfizer Inc (NYSE: PFE) moved..."
Tesla stock gets a logical synopsis from Jim Cramer,Biztoc.com,https://biztoc.com/x/aa9fd24bb9068b06,2024-07-30T18:33:42Z,"Tesla stock (NASDAQ: TSLA) got a logical synopsis from analyst and television personality Jim Cramer, who said the company should not be regarded as an automaker but as something else entirely.
Tesla shares are widely analyzed by Wall Street based on its perf…"
Dow Jones Futures Rise On Hot Inflation Data; Tesla Stock Downgraded To Sell,Investor's Business Daily,https://www.investors.com/market-trend/stock-market-today/dow-jones-sp500-nasdaq/,2024-07-12T13:15:07Z,"Tesla was downgraded to sell, while Citigroup and JPMorgan are earnings movers."
Tesla stock on track for tenth consecutive day of gains as investors eye growth potential,Biztoc.com,https://biztoc.com/x/84fe1cf6d569bf6c,2024-07-09T17:10:05Z,"Tesla's stock (TSLA) was on track for its tenth straight day of gains Tuesday as shares bounced about 4% higher in mid-afternoon trading.
The positive moves mean Tesla has erased all of its year-to-date losses with the stock up about 5% since the start of the…"
"Automakers' share of China NEV market in Jun: BYD tops with 32.7%, Tesla 3rd with 6.9%",Biztoc.com,https://biztoc.com/x/0f237a2c38794e60,2024-07-10T10:05:12Z,"BYD (HKG: 1211, OTCMKTS: BYDDY) continued to have the largest share of China's new energy vehicle (NEV) market last month, while Tesla (NASDAQ: TSLA) stayed in third place with the same share as in May.
BYD sold 280,095 passenger NEVs at retail in China in Ju…"
The bare minimum is working wonders for Elon Musk,Biztoc.com,https://biztoc.com/x/5f269970171bf9a7,2024-07-04T13:57:58Z,"Despite the rhetoric displayed by figurehead Elon Musk during an earnings call just a few months ago, Tesla (TSLA) is still a car company. 
In the midst of yearning for a future stemming from robotics, artificial intelligence, and robotaxis, the latest produc…"
Analysts race to reset Tesla stock price targets after earnings,Biztoc.com,https://biztoc.com/x/ab676caef4c6cf12,2024-07-24T11:56:33Z,"Tesla shares slumped lower in early Wednesday trading as analysts moved quickly to revisit their ratings and price targets on the carmaker following a disappointing second quarter earnings report. 
Tesla (TSLA) , which had rallied nearly 25% since reporting a…"
Apple shares hit new all-time intraday and closing highs,Macdailynews.com,https://macdailynews.com/2024/07/03/apple-shares-hit-new-all-time-intraday-and-closing-highs-81/,2024-07-03T17:40:29Z,"In Nasdaq trading today, shares of Apple Inc. rose to hit new all-time intraday and closing highs. Apple’s all-time intraday high was set on…
The post Apple shares hit new all-time intraday and closing highs appeared first on MacDailyNews."
"JPMorgan Beats Earnings Views, Wells Fargo Falls On Forecast, Citi To Report",Investor's Business Daily,https://www.investors.com/news/jpm-stock-jpmorgan-earnings-citigroup-wells-fargo/,2024-07-12T11:28:01Z,"Wells Fargo, just below a buy point, also reports Friday morning."
Apple shares hit new all-time intraday and closing highs,Macdailynews.com,https://macdailynews.com/2024/07/02/apple-shares-hit-new-all-time-intraday-and-closing-highs-240702/,2024-07-02T20:18:58Z,"In Nasdaq trading today, shares of Apple Inc. rose to hit new all-time intraday and closing highs. Apple’s all-time intraday high was set on…
The post Apple shares hit new all-time intraday and closing highs appeared first on MacDailyNews."
Prediction: 3 Stocks That Will Be Worth More Than Apple 3 Years From Now,Biztoc.com,https://biztoc.com/x/8435a80958abcf93,2024-07-14T23:38:09Z,"Apple (AAPL 1.30%) recently became the world's most valuable company again with a market cap of $3.57 billion. Its stock rallied more than 60% over the past three years, even as iPhone sales cooled off amid tougher macro and competitive headwinds.
From fiscal…"
"Tesla, Alphabet, Nvidia, AT&T, Visa, Texas Instruments, Enphase, and More Movers",Biztoc.com,https://biztoc.com/x/4fd2f6fbc4fcd6d1,2024-07-24T12:51:11Z,"Tesla, Alphabet, Nvidia, AT&T, Visa, Texas Instruments, Enphase, and More Movers Barron's
Stocks making the biggest moves premarket: Alphabet, Tesla, Texas Instruments, Meta Platforms and more CNBC
Biggest stock movers today: TSLA, V, DB, and more (NASDAQ:ENP…"
BYD Has Its Eyes Set On Conquering Europe,Biztoc.com,https://biztoc.com/x/e639de3d30d17f60,2024-07-09T16:59:02Z,"On Monday, BYD Company Limited (OTC: BYDDY) signed a deal to open a $1 billion electric-vehicle factory in Turkey, directly threatening the dominance of Tesla Inc (NASDAQ: TSLA) in several European markets.
BYD Is Boosting Its Presence In Europe
Although BYD …"
JPMorgan Chase (JPM) Q2 2024 Earnings Call Transcript,Yahoo Entertainment,https://consent.yahoo.com/v2/collectConsent?sessionId=1_cc-session_db98ea80-12c6-49f5-8fe6-749a786080a6,2024-07-12T17:45:18Z,
Apple shares hit new all-time intraday and closing highs,Macdailynews.com,https://macdailynews.com/2024/07/09/apple-shares-hit-new-all-time-intraday-and-closing-highs-240709/,2024-07-09T20:15:51Z,"In Nasdaq trading today, shares of Apple Inc. rose to hit new all-time intraday and closing highs. Apple’s all-time intraday high was set on…
The post Apple shares hit new all-time intraday and closing highs appeared first on MacDailyNews."
Apple shares hit new all-time closing high,Macdailynews.com,https://macdailynews.com/2024/07/16/apple-shares-hit-new-all-time-closing-high-26/,2024-07-16T20:11:02Z,"In Nasdaq trading today, shares of Apple Inc. rose to hit a new all-time closing high. Apple’s all-time intraday high was set on…
The post Apple shares hit new all-time closing high appeared first on MacDailyNews."
Exxon Mobil Corporation (XOM): Why Is It One of the Best Dividend Stocks to Buy?,Yahoo Entertainment,https://consent.yahoo.com/v2/collectConsent?sessionId=1_cc-session_83e5ba96-685c-480b-8f39-0c804dca485d,2024-07-16T20:48:39Z,
"Stock market news today: Stocks waver in wait for key earnings, Fed meeting kickoff",Yahoo Entertainment,https://finance.yahoo.com/news/live/stock-market-news-today-sp-500-nasdaq-drop-in-wait-for-key-earnings-fed-meeting-kicks-off-141615905.html,2024-07-30T14:16:15Z,A packed day of earnings and the start of the Fed's July meeting continue a potentially pivotal week for stocks.
Apple (AAPL) Traded Higher After Its AI Strategy Announcement,Yahoo Entertainment,https://consent.yahoo.com/v2/collectConsent?sessionId=1_cc-session_3fc3dd01-e8cd-413e-bf1d-89d54eaf9a92,2024-07-18T06:19:41Z,
Apple shares hit new all-time intraday and closing highs,Macdailynews.com,https://macdailynews.com/2024/07/15/apple-shares-hit-new-all-time-intraday-and-closing-highs-240715/,2024-07-15T20:10:45Z,"In Nasdaq trading today, shares of Apple Inc. rose to hit new all-time intraday and closing highs. Apple’s all-time intraday high was set on…
The post Apple shares hit new all-time intraday and closing highs appeared first on MacDailyNews."
Apple shares hit new all-time intraday and closing highs,Macdailynews.com,https://macdailynews.com/2024/07/05/apple-shares-hit-new-all-time-intraday-and-closing-highs-82/,2024-07-05T20:30:20Z,"In Nasdaq trading today, shares of Apple Inc. rose to hit new all-time intraday and closing highs. Apple’s all-time intraday high was set on…
The post Apple shares hit new all-time intraday and closing highs appeared first on MacDailyNews."
Apple shares hit new all-time intraday and closing highs,Macdailynews.com,https://macdailynews.com/2024/07/08/apple-shares-hit-new-all-time-intraday-and-closing-highs-240708/,2024-07-08T20:19:18Z,"In Nasdaq trading today, shares of Apple Inc. rose to hit new all-time intraday and closing highs. Apple’s all-time intraday high was set on…
The post Apple shares hit new all-time intraday and closing highs appeared first on MacDailyNews."
Apple shares hit new all-time intraday and closing highs,Macdailynews.com,https://macdailynews.com/2024/07/10/apple-shares-hit-new-all-time-intraday-and-closing-highs-83/,2024-07-10T20:18:37Z,"In Nasdaq trading today, shares of Apple Inc. rose to hit new all-time intraday and closing highs. Apple’s all-time intraday high was set on…
The post Apple shares hit new all-time intraday and closing highs appeared first on MacDailyNews."
Apple (AAPL) Re-Emerged as a Top Performer in Q2,Yahoo Entertainment,https://consent.yahoo.com/v2/collectConsent?sessionId=1_cc-session_b6696a69-3d0f-4bec-abd7-58a4954aacf4,2024-07-22T07:28:59Z,
"Stock market news today: S&P 500, Nasdaq drop in wait for key earnings, Fed meeting kicks off",Yahoo Entertainment,https://finance.yahoo.com/news/live/stock-market-news-today-nasdaq-sinks-nvidia-drops-5-ahead-of-next-round-of-big-tech-earnings-141615307.html,2024-07-30T14:16:15Z,A packed day of earnings and the start of the Fed's July meeting continue a potentially pivotal week for stocks.
"Stock market news today: S&P 500 edges up in wait for key earnings, Fed meeting kickoff",Yahoo Entertainment,https://finance.yahoo.com/news/live/stock-market-news-today-stocks-waver-in-wait-for-key-earnings-fed-meeting-kickoff-141615238.html,2024-07-30T14:16:15Z,A packed day of earnings and the start of the Fed's July meeting continue a potentially pivotal week for stocks.
"UBS is downgrading Tesla because the stock has risen 'too much, too soon' thanks to its AI ambitions",Quartz India,https://qz.com/tesla-stock-decline-robotaxi-delay-ubs-downgrade-musk-1851589375,2024-07-12T13:48:00Z,"Tesla stock is falling after the stock was downgraded by UBS group, which said the shares have risen “too much, too soon,” before any real payoff from the company’s focus on artificial intelligence.Read more..."
"Halliburton Stock Down 8% This Year, What’s Next?",Forbes,https://www.forbes.com/sites/greatspeculations/2024/07/03/halliburton-stock-down-8-this-year-whats-next/,2024-07-03T14:00:00Z,"After an 8% decline since the beginning of the year, we believe Halliburton stock (NYSE: HAL), has upside potential in the longer run."
